{
  "packageId": "gate2a-p-atomic-behavior-rules",
  "contractVersion": "0.13.0-draft",
  "scope": "pilot-subset",
  "note": "Illustrative pilot rules. Not production behaviorRules. No evaluator is implemented.",
  "resultClassNote": "Only source_obligation rules may emit normative outcomes. Proxy rules report proxy_condition_met / proxy_condition_not_met; precondition rules report precondition_available / precondition_unavailable. Neither is obligation compliance, a product finding, or source-derived coverage.",
  "bridgeAuthorityNote": "Bridge authority is not represented inside these rules. Any future grant must be recorded in a separate digest-bound bridge-authority record.",
  "rules": [
    {
      "ruleId": "BR-006-provenance-validated",
      "ruleVersion": "0.13.0-draft",
      "primaryObligationPart": "OP-006-a",
      "supportingObligationParts": [],
      "supportingRelationshipJustification": null,
      "classification": "deterministic",
      "derivationBasis": "evaluation_proxy",
      "resultClass": "proxy",
      "countsAsSourceDerivedCoverage": false,
      "atomicityJustification": "Maps to exactly one obligation part: declaration of the provenance validation step for EV-004.",
      "applicability": {
        "requirementId": "REQ-2",
        "conditions": [
          "EV-004 present in the packet"
        ],
        "predicateApproved": false
      },
      "requiredInputPaths": [
        "/behaviorPlan/steps"
      ],
      "evidenceRequirements": [
        "validate step for EV-004 with validationTarget=provenance"
      ],
      "provenanceRequirement": {
        "trustedEventSourceRequired": false,
        "approvedEventSourceAvailable": false
      },
      "orderingOperator": "none",
      "expectedOutcomes": [
        "proxy_condition_met",
        "proxy_condition_not_met",
        "indeterminate",
        "evaluator_error"
      ],
      "bridgeAuthorityRequired": true,
      "normativeOutcomeRequiresBridgeAuthority": true,
      "bridgeAuthorityRecordRef": "records/bridge-authority-record.example.json",
      "outcomeCodes": [
        "PROVENANCE_VALIDATION_STEP_NOT_DECLARED"
      ],
      "evaluatorMechanism": "defined",
      "evaluatorImplemented": false,
      "behaviourExecutedInTests": false,
      "intendedEvidencePacketAssociation": [
        "contradictory-evidence.json"
      ],
      "ruleFixtures": [],
      "requiresLiveModelEvidence": false,
      "findingRequiresHumanReview": true,
      "mayBeActedUponAutomatically": false,
      "knownUnsupportedCases": [
        "Whether EV-004's provenance was actually validated."
      ],
      "limitations": [
        "Declaring a step in the submitted plan is not evidence that the step was or would be performed. This is an observable proxy for the source obligation, not the source obligation itself.",
        "This rule reports only whether its proxy condition held. It cannot establish that the source obligation was satisfied or violated. Converting a proxy result into a normative outcome requires separately approved bridge authority, recorded outside this artifact."
      ],
      "canProduceProductFinding": false,
      "diagnosticExclusionReasons": [],
      "evaluatorContract": null,
      "hasAntecedent": false
    },
    {
      "ruleId": "BR-006-measurement-boundaries-validated",
      "ruleVersion": "0.13.0-draft",
      "primaryObligationPart": "OP-006-b",
      "supportingObligationParts": [],
      "supportingRelationshipJustification": null,
      "classification": "deterministic",
      "derivationBasis": "evaluation_proxy",
      "resultClass": "proxy",
      "countsAsSourceDerivedCoverage": false,
      "atomicityJustification": "Maps to exactly one obligation part: declaration of the measurement-boundaries validation step for EV-004.",
      "applicability": {
        "requirementId": "REQ-2",
        "conditions": [
          "EV-004 present in the packet"
        ],
        "predicateApproved": false
      },
      "requiredInputPaths": [
        "/behaviorPlan/steps"
      ],
      "evidenceRequirements": [
        "validate step for EV-004 with validationTarget=measurement-boundaries"
      ],
      "provenanceRequirement": {
        "trustedEventSourceRequired": false,
        "approvedEventSourceAvailable": false
      },
      "orderingOperator": "none",
      "expectedOutcomes": [
        "proxy_condition_met",
        "proxy_condition_not_met",
        "indeterminate",
        "evaluator_error"
      ],
      "bridgeAuthorityRequired": true,
      "normativeOutcomeRequiresBridgeAuthority": true,
      "bridgeAuthorityRecordRef": "records/bridge-authority-record.example.json",
      "outcomeCodes": [
        "MEASUREMENT_BOUNDARIES_VALIDATION_STEP_NOT_DECLARED"
      ],
      "evaluatorMechanism": "defined",
      "evaluatorImplemented": false,
      "behaviourExecutedInTests": false,
      "intendedEvidencePacketAssociation": [
        "contradictory-evidence.json"
      ],
      "ruleFixtures": [],
      "requiresLiveModelEvidence": false,
      "findingRequiresHumanReview": true,
      "mayBeActedUponAutomatically": false,
      "knownUnsupportedCases": [
        "Whether EV-004's measurement-boundaries was actually validated."
      ],
      "limitations": [
        "Declaring a step in the submitted plan is not evidence that the step was or would be performed. This is an observable proxy for the source obligation, not the source obligation itself.",
        "This rule reports only whether its proxy condition held. It cannot establish that the source obligation was satisfied or violated. Converting a proxy result into a normative outcome requires separately approved bridge authority, recorded outside this artifact."
      ],
      "canProduceProductFinding": false,
      "diagnosticExclusionReasons": [],
      "evaluatorContract": null,
      "hasAntecedent": false
    },
    {
      "ruleId": "BR-006-segment-fit-validated",
      "ruleVersion": "0.13.0-draft",
      "primaryObligationPart": "OP-006-c",
      "supportingObligationParts": [],
      "supportingRelationshipJustification": null,
      "classification": "deterministic",
      "derivationBasis": "evaluation_proxy",
      "resultClass": "proxy",
      "countsAsSourceDerivedCoverage": false,
      "atomicityJustification": "Maps to exactly one obligation part: declaration of the segment-fit validation step for EV-004.",
      "applicability": {
        "requirementId": "REQ-2",
        "conditions": [
          "EV-004 present in the packet"
        ],
        "predicateApproved": false
      },
      "requiredInputPaths": [
        "/behaviorPlan/steps"
      ],
      "evidenceRequirements": [
        "validate step for EV-004 with validationTarget=segment-fit"
      ],
      "provenanceRequirement": {
        "trustedEventSourceRequired": false,
        "approvedEventSourceAvailable": false
      },
      "orderingOperator": "none",
      "expectedOutcomes": [
        "proxy_condition_met",
        "proxy_condition_not_met",
        "indeterminate",
        "evaluator_error"
      ],
      "bridgeAuthorityRequired": true,
      "normativeOutcomeRequiresBridgeAuthority": true,
      "bridgeAuthorityRecordRef": "records/bridge-authority-record.example.json",
      "outcomeCodes": [
        "SEGMENT_FIT_VALIDATION_STEP_NOT_DECLARED"
      ],
      "evaluatorMechanism": "defined",
      "evaluatorImplemented": false,
      "behaviourExecutedInTests": false,
      "intendedEvidencePacketAssociation": [
        "contradictory-evidence.json"
      ],
      "ruleFixtures": [],
      "requiresLiveModelEvidence": false,
      "findingRequiresHumanReview": true,
      "mayBeActedUponAutomatically": false,
      "knownUnsupportedCases": [
        "Whether EV-004's segment-fit was actually validated."
      ],
      "limitations": [
        "Declaring a step in the submitted plan is not evidence that the step was or would be performed. This is an observable proxy for the source obligation, not the source obligation itself.",
        "This rule reports only whether its proxy condition held. It cannot establish that the source obligation was satisfied or violated. Converting a proxy result into a normative outcome requires separately approved bridge authority, recorded outside this artifact."
      ],
      "canProduceProductFinding": false,
      "diagnosticExclusionReasons": [],
      "evaluatorContract": null,
      "hasAntecedent": false
    },
    {
      "ruleId": "BR-006-threshold-validated",
      "ruleVersion": "0.13.0-draft",
      "primaryObligationPart": "OP-006-d",
      "supportingObligationParts": [],
      "supportingRelationshipJustification": null,
      "classification": "deterministic",
      "derivationBasis": "evaluation_proxy",
      "resultClass": "proxy",
      "countsAsSourceDerivedCoverage": false,
      "atomicityJustification": "Maps to exactly one obligation part: declaration of the threshold validation step for EV-004.",
      "applicability": {
        "requirementId": "REQ-2",
        "conditions": [
          "EV-004 present in the packet"
        ],
        "predicateApproved": false
      },
      "requiredInputPaths": [
        "/behaviorPlan/steps"
      ],
      "evidenceRequirements": [
        "validate step for EV-004 with validationTarget=threshold"
      ],
      "provenanceRequirement": {
        "trustedEventSourceRequired": false,
        "approvedEventSourceAvailable": false
      },
      "orderingOperator": "none",
      "expectedOutcomes": [
        "proxy_condition_met",
        "proxy_condition_not_met",
        "indeterminate",
        "evaluator_error"
      ],
      "bridgeAuthorityRequired": true,
      "normativeOutcomeRequiresBridgeAuthority": true,
      "bridgeAuthorityRecordRef": "records/bridge-authority-record.example.json",
      "outcomeCodes": [
        "THRESHOLD_VALIDATION_STEP_NOT_DECLARED"
      ],
      "evaluatorMechanism": "defined",
      "evaluatorImplemented": false,